{
  "version": 1,
  "description_hash": "e3e279764f2fc770a732ddf6e49dfa9616fe8b0903eaef0d1120d629f485fe42",
  "description_text": "ZBTP Project",
  "participants": [
    "828c0b23e115589cd5708e9bf1578a37c231152225cf5aa35e3ea3bffc721924",
    "989a0a805578bffd03e0bebd0f022355e71b2084717d2c7143d377313c69fbf6"
  ],
  "referenced_project_id": null,
  "external_link": "https://github.com/kisec825/zbtp",
  "created_at": "2025-12-16T06:42:44.786168Z",
  "random_salt": "1b6408c784cfb33b56e77ad624b5b42f",
  "project_id": "ff94e89d9fb7b6e8f293cbb2eb50a9dc5b5a088abc75b6ba352e7d0ea809ca1c"
}